{
  "id": "123456789012345678",
  "name": "WGU Cybersecurity",
  "description": "WGU Cybersecurity and Information Assurance students",
  "inviteUrl": "https://discord.gg/wgu-cybersecurity",
  "hierarchy": {
    "level": "program",
    "college": "technology",
    "program": "Cybersecurity and Information Assurance"
  },
  "channels": []
}